{
  "id": "20261020",
  "title": "2026年小二上翰林版",
  "year": "2026",
  "publisherCode": "1",
  "grade": "02",
  "semester": "0",
  "version": "1.0.0",
  "questions": [
    {
      "id": "202610201201",
      "examPhase": "midterm_before",
      "readText": "我念著一首小詩",
      "tokens": [
        {
          "type": "text",
          "char": "我",
          "zhuyin": "ㄨㄛˇ"
        },
        {
          "type": "blank",
          "char": "念",
          "zhuyin": "ㄋㄧㄢˋ"
        },
        {
          "type": "text",
          "char": "著",
          "zhuyin": "ㄓㄨˋ"
        },
        {
          "type": "text",
          "char": "一",
          "zhuyin": "ㄧ"
        },
        {
          "type": "blank",
          "char": "首",
          "zhuyin": "ㄕㄡˇ"
        },
        {
          "type": "text",
          "char": "小",
          "zhuyin": "ㄒㄧㄠˇ"
        },
        {
          "type": "blank",
          "char": "詩",
          "zhuyin": "ㄕ"
        }
      ]
    },
    {
      "id": "202610201202",
      "examPhase": "midterm_before",
      "readText": "天鵝曲項浮水面",
      "tokens": [
        {
          "type": "text",
          "char": "天",
          "zhuyin": "ㄊㄧㄢ"
        },
        {
          "type": "text",
          "char": "鵝",
          "zhuyin": "ㄜˊ"
        },
        {
          "type": "blank",
          "char": "曲",
          "zhuyin": "ㄑㄩ"
        },
        {
          "type": "blank",
          "char": "項",
          "zhuyin": "ㄒㄧㄤˋ"
        },
        {
          "type": "blank",
          "char": "浮",
          "zhuyin": "ㄈㄨˊ"
        },
        {
          "type": "text",
          "char": "水",
          "zhuyin": "ㄕㄨㄟˇ"
        },
        {
          "type": "text",
          "char": "面",
          "zhuyin": "ㄇㄧㄢˋ"
        }
      ]
    },
    {
      "id": "202610201203",
      "examPhase": "midterm_before",
      "readText": "紅掌輕輕撥水波",
      "tokens": [
        {
          "type": "text",
          "char": "紅",
          "zhuyin": "ㄏㄨㄥˊ"
        },
        {
          "type": "blank",
          "char": "掌",
          "zhuyin": "ㄓㄤˇ"
        },
        {
          "type": "text",
          "char": "輕",
          "zhuyin": "ㄑㄧㄥ"
        },
        {
          "type": "text",
          "char": "輕",
          "zhuyin": "ㄑㄧㄥ"
        },
        {
          "type": "blank",
          "char": "撥",
          "zhuyin": "ㄅㄛ"
        },
        {
          "type": "text",
          "char": "水",
          "zhuyin": "ㄕㄨㄟˇ"
        },
        {
          "type": "blank",
          "char": "波",
          "zhuyin": "ㄅㄛ"
        }
      ]
    },
    {
      "id": "202610201204",
      "examPhase": "midterm_before",
      "readText": "詩人作了一首詩",
      "tokens": [
        {
          "type": "blank",
          "char": "詩",
          "zhuyin": "ㄕ"
        },
        {
          "type": "text",
          "char": "人",
          "zhuyin": "ㄖㄣˊ"
        },
        {
          "type": "blank",
          "char": "作",
          "zhuyin": "ㄗㄨㄛˋ"
        },
        {
          "type": "text",
          "char": "了",
          "zhuyin": "ㄌㄜ˙"
        },
        {
          "type": "text",
          "char": "一",
          "zhuyin": "ㄧ"
        },
        {
          "type": "blank",
          "char": "首",
          "zhuyin": "ㄕㄡˇ"
        },
        {
          "type": "blank",
          "char": "詩",
          "zhuyin": "ㄕ"
        }
      ]
    },
    {
      "id": "202610201205",
      "examPhase": "midterm_before",
      "readText": "我指著長長脖子",
      "tokens": [
        {
          "type": "text",
          "char": "我",
          "zhuyin": "ㄨㄛˇ"
        },
        {
          "type": "blank",
          "char": "指",
          "zhuyin": "ㄓˇ"
        },
        {
          "type": "text",
          "char": "著",
          "zhuyin": "ㄓㄨˋ"
        },
        {
          "type": "text",
          "char": "長",
          "zhuyin": "ㄓㄤˇ"
        },
        {
          "type": "text",
          "char": "長",
          "zhuyin": "ㄓㄤˇ"
        },
        {
          "type": "blank",
          "char": "脖",
          "zhuyin": "ㄅㄛˊ"
        },
        {
          "type": "text",
          "char": "子",
          "zhuyin": "ㄗ˙"
        }
      ]
    },
    {
      "id": "202610201206",
      "examPhase": "midterm_before",
      "readText": "牠伸長身體游泳",
      "tokens": [
        {
          "type": "text",
          "char": "牠",
          "zhuyin": "ㄊㄚ"
        },
        {
          "type": "blank",
          "char": "伸",
          "zhuyin": "ㄕㄣ"
        },
        {
          "type": "text",
          "char": "長",
          "zhuyin": "ㄓㄤˇ"
        },
        {
          "type": "blank",
          "char": "身",
          "zhuyin": "ㄕㄣ"
        },
        {
          "type": "blank",
          "char": "體",
          "zhuyin": "ㄊㄧˇ"
        },
        {
          "type": "text",
          "char": "游",
          "zhuyin": "ㄧㄡˊ"
        },
        {
          "type": "text",
          "char": "泳",
          "zhuyin": "ㄩㄥˇ"
        }
      ]
    },
    {
      "id": "202610201207",
      "examPhase": "midterm_before",
      "readText": "一隻鵝在水上浮",
      "tokens": [
        {
          "type": "text",
          "char": "一",
          "zhuyin": "ㄧ"
        },
        {
          "type": "blank",
          "char": "隻",
          "zhuyin": "ㄓ"
        },
        {
          "type": "text",
          "char": "鵝",
          "zhuyin": "ㄜˊ"
        },
        {
          "type": "text",
          "char": "在",
          "zhuyin": "ㄗㄞˋ"
        },
        {
          "type": "text",
          "char": "水",
          "zhuyin": "ㄕㄨㄟˇ"
        },
        {
          "type": "text",
          "char": "上",
          "zhuyin": "ㄕㄤˋ"
        },
        {
          "type": "blank",
          "char": "浮",
          "zhuyin": "ㄈㄨˊ"
        }
      ]
    },
    {
      "id": "202610201208",
      "examPhase": "midterm_before",
      "readText": "身體練習倒立",
      "tokens": [
        {
          "type": "blank",
          "char": "身",
          "zhuyin": "ㄕㄣ"
        },
        {
          "type": "blank",
          "char": "體",
          "zhuyin": "ㄊㄧˇ"
        },
        {
          "type": "text",
          "char": "練",
          "zhuyin": "ㄌㄧㄢˋ"
        },
        {
          "type": "text",
          "char": "習",
          "zhuyin": "ㄒㄧˊ"
        },
        {
          "type": "blank",
          "char": "倒",
          "zhuyin": "ㄉㄠˋ"
        },
        {
          "type": "text",
          "char": "立",
          "zhuyin": "ㄌㄧˋ"
        }
      ]
    },
    {
      "id": "202610201209",
      "examPhase": "midterm_before",
      "readText": "小鵝用腳掌拍肚皮",
      "tokens": [
        {
          "type": "text",
          "char": "小",
          "zhuyin": "ㄒㄧㄠˇ"
        },
        {
          "type": "text",
          "char": "鵝",
          "zhuyin": "ㄜˊ"
        },
        {
          "type": "text",
          "char": "用",
          "zhuyin": "ㄩㄥˋ"
        },
        {
          "type": "text",
          "char": "腳",
          "zhuyin": "ㄐㄧㄠˇ"
        },
        {
          "type": "blank",
          "char": "掌",
          "zhuyin": "ㄓㄤˇ"
        },
        {
          "type": "text",
          "char": "拍",
          "zhuyin": "ㄆㄞ"
        },
        {
          "type": "blank",
          "char": "肚",
          "zhuyin": "ㄉㄨˋ"
        },
        {
          "type": "text",
          "char": "皮",
          "zhuyin": "ㄆㄧˊ"
        }
      ]
    },
    {
      "id": "202610201210",
      "examPhase": "midterm_before",
      "readText": "水波旁有一隻白鵝",
      "tokens": [
        {
          "type": "text",
          "char": "水",
          "zhuyin": "ㄕㄨㄟˇ"
        },
        {
          "type": "blank",
          "char": "波",
          "zhuyin": "ㄅㄛ"
        },
        {
          "type": "text",
          "char": "旁",
          "zhuyin": "ㄆㄤˊ"
        },
        {
          "type": "text",
          "char": "有",
          "zhuyin": "ㄧㄡˇ"
        },
        {
          "type": "text",
          "char": "一",
          "zhuyin": "ㄧ"
        },
        {
          "type": "blank",
          "char": "隻",
          "zhuyin": "ㄓ"
        },
        {
          "type": "text",
          "char": "白",
          "zhuyin": "ㄅㄞˊ"
        },
        {
          "type": "text",
          "char": "鵝",
          "zhuyin": "ㄜˊ"
        }
      ]
    }
  ]
}
